{
  "$schema": "https://json-schema.org/draft/2020-12/schema",
  "$id": "sources.schema.json",
  "type": "array",
  "items": {
    "type": "object",
    "required": ["source_id", "name"],
    "properties": {
      "source_id": { "type": "string", "minLength": 1 },
      "name": { "type": "string", "minLength": 1 },
      "base_url": { "type": "string" },
      "notes": { "type": "string" },
      "last_crawled_at": { "type": "string" }
    },
    "additionalProperties": false
  }
}

