[
  {
    "base_url": "https://www.unical.it/campus/visita-il-campus/mappa/",
    "last_crawled_at": "2026-02-10T10:22:23.927385+00:00",
    "name": "UNICAL Aula Map",
    "notes": "Generated by unical_scraper crawl aulas",
    "source_id": "unical-aulas"
  },
  {
    "base_url": "https://www.unical.it/campus/visita-il-campus/mappa/",
    "last_crawled_at": "2026-02-09T12:15:34.216323+00:00",
    "name": "UNICAL Campus Map",
    "notes": "Generated by unical_scraper crawl buildings",
    "source_id": "unical-campus-map"
  },
  {
    "base_url": "https://www.unical.it/organizzazione/strutture/dipartimenti/",
    "last_crawled_at": "2026-02-09T11:45:46.060856+00:00",
    "name": "UNICAL Departments",
    "notes": "Generated by unical_scraper crawl departments",
    "source_id": "unical-departments"
  },
  {
    "base_url": "https://www.unical.it/campus/servizi/",
    "last_crawled_at": "2026-02-09T14:44:43.761315+00:00",
    "name": "UNICAL Services",
    "notes": "Generated by unical_scraper crawl services",
    "source_id": "unical-services"
  },
  {
    "base_url": "https://www.unical.it/storage/teachers/",
    "last_crawled_at": "2026-02-09T11:54:50.806908+00:00",
    "name": "UNICAL Teachers Directory",
    "notes": "Generated by unical_scraper crawl teachers",
    "source_id": "unical-teachers"
  }
]
